{
  "case_id": "D2-015",
  "corpus_checksum": "3711d88475bd81da311be795b13c971c805ee3509eec8ddf352daec79b11a021",
  "corpus_version": "D2",
  "decisions": [],
  "evaluation_id": "d2-one-shot-4368c4a3-530d-4ffc-bb41-610928825409",
  "mismatches": [
    {
      "actual": "14 mg",
      "confidence": 0.55,
      "details": {
        "mention": "adesivo",
        "reason": "saved v2 trace contains semantic mismatch without earlier boundary evidence"
      },
      "expected": "7 mg",
      "policy_rules": [
        "ptbr-dose",
        "ptbr-active-medication-context"
      ],
      "semantic_dimension": "dose",
      "stage": "prediction"
    },
    {
      "actual": "14",
      "confidence": 0.55,
      "details": {
        "mention": "adesivo",
        "reason": "saved v2 trace contains semantic mismatch without earlier boundary evidence"
      },
      "expected": "7",
      "policy_rules": [
        "ptbr-dose",
        "ptbr-active-medication-context"
      ],
      "semantic_dimension": "dose_value",
      "stage": "prediction"
    },
    {
      "actual": [
        {
          "relation_type": "CHANGED_FROM",
          "target": "dose",
          "value": "14 mg"
        }
      ],
      "confidence": 0.86,
      "details": {
        "mention": "adesivo",
        "relation_output_count": 1
      },
      "expected": [
        {
          "relation_type": "CHANGED_FROM",
          "target": "dose",
          "value": "14 mg"
        },
        {
          "relation_type": "HAS_DOSE",
          "target": "dose",
          "value": "7 mg"
        }
      ],
      "policy_rules": [],
      "semantic_dimension": "relations",
      "stage": "generated_relations"
    }
  ],
  "policy_version": "1.3",
  "resolver_checksum": "ff09e39196d8458637629dce70da5bd20c4c5b0f5af5cd83a0d19b27e3a186ab",
  "resolver_version": "440caca7b29df3c615fe4055a7e0f9d7c11178c6",
  "snapshots": [
    {
      "chain_hash": "94f71058d5df4e8e2e0d0c081e240db5d3b69ce3d5700ce6770ff353bba13b81",
      "changed_fields": [],
      "decisions": [],
      "dropped_fields": [],
      "granularity": {},
      "input_hash": null,
      "output_hash": "cd47668726c36bbcafa9147e2b52cc7698d6ebcf20d11c534da3a1e3c80701da",
      "payload": {
        "segments": [
          {
            "segment_id": "e1",
            "speaker": "patient",
            "text": "O adesivo era de 14 mg."
          },
          {
            "segment_id": "e2",
            "speaker": "patient",
            "text": "No mês seguinte passei para 7 mg."
          }
        ]
      },
      "preserved_fields": [],
      "provenance": {
        "case_id": "D2-015",
        "stage_source": "evaluation_boundary",
        "trace_capture": "D2_trace_granularity_v2"
      },
      "stage": "input_segments"
    },
    {
      "chain_hash": "4c7b23fe44e79283535d4e76b6328323fb41cb3c32e8da289ea68c8cec0221d3",
      "changed_fields": [],
      "decisions": [],
      "dropped_fields": [],
      "granularity": {},
      "input_hash": "cd47668726c36bbcafa9147e2b52cc7698d6ebcf20d11c534da3a1e3c80701da",
      "output_hash": "83182dca7ffa240407a671146e8c35f30a32c297ee51af00c48dc717250e015d",
      "payload": {
        "mentions": []
      },
      "preserved_fields": [],
      "provenance": {
        "case_id": "D2-015",
        "stage_source": "adapter_result_provenance",
        "trace_capture": "D2_trace_granularity_v2"
      },
      "stage": "local_mentions"
    },
    {
      "chain_hash": "f17fae32bfc4bc49835b648a4fbf75b9441c217b692cc020ade64aff1b77eeea",
      "changed_fields": [],
      "decisions": [],
      "dropped_fields": [],
      "granularity": {
        "candidate_to_resolved_field_map": {
          "candidate_trace": {},
          "resolved_fields": {
            "m1": {
              "certainty": "confirmed",
              "dose": "14 mg",
              "dose_unit": "mg",
              "dose_value": "14",
              "experiencer": "patient",
              "frequency": null,
              "laterality": null,
              "negated": false,
              "route": null,
              "status": "active",
              "temporality": "current"
            }
          }
        },
        "dropped_fields_by_stage": {},
        "ownership_decisions": {
          "attribute_ownership": {
            "experiencer": {
              "owner_mention_id": "context:e1",
              "owner_segment_id": "e1"
            }
          },
          "segment_provenance": {}
        },
        "per_mention_attributes": {
          "m1": {
            "fields": {
              "certainty": "confirmed",
              "dose": "14 mg",
              "dose_unit": "mg",
              "dose_value": "14",
              "experiencer": "patient",
              "frequency": null,
              "laterality": null,
              "negated": false,
              "route": null,
              "status": "active",
              "temporality": "current"
            },
            "surface": "adesivo"
          }
        },
        "per_mention_relations": {
          "m1": [
            {
              "relation_type": "CHANGED_FROM",
              "target": "dose",
              "value": "14 mg"
            }
          ]
        },
        "projection_field_map": {
          "m1": {
            "certainty": "confirmed",
            "dose": "14 mg",
            "dose_unit": "mg",
            "dose_value": "14",
            "experiencer": "patient",
            "frequency": null,
            "laterality": null,
            "negated": false,
            "route": null,
            "status": "active",
            "temporality": "current"
          }
        },
        "relation_generation_inputs": {
          "existing_projection_relations": [
            {
              "confidence": 1.0,
              "provenance": {
                "source_segment_ids": [
                  "e1"
                ]
              },
              "relation_id": "context:e1:11:18:CHANGED_FROM:dose:14 mg",
              "relation_type": "CHANGED_FROM",
              "source": "context:e1:11:18",
              "source_mention_id": "context:e1:11:18",
              "source_segment_ids": [
                "e1"
              ],
              "target": "dose",
              "target_mention_id": "dose",
              "value": "14 mg"
            }
          ],
          "resolved_semantics": {
            "m1": {
              "certainty": "confirmed",
              "dose": "14 mg",
              "dose_unit": "mg",
              "dose_value": "14",
              "experiencer": "patient",
              "frequency": null,
              "laterality": null,
              "negated": false,
              "route": null,
              "status": "active",
              "temporality": "current"
            }
          }
        },
        "relation_generation_outputs": {
          "relations": {
            "m1": [
              {
                "relation_type": "CHANGED_FROM",
                "target": "dose",
                "value": "14 mg"
              }
            ]
          }
        },
        "transformed_fields_by_stage": {}
      },
      "input_hash": "83182dca7ffa240407a671146e8c35f30a32c297ee51af00c48dc717250e015d",
      "output_hash": "9f6c0bb1021fca740f0449be476c2dd88edd95c6b31bf6082db942512e64c9ad",
      "payload": {
        "candidate_trace": {}
      },
      "preserved_fields": [],
      "provenance": {
        "case_id": "D2-015",
        "stage_source": "adapter_result_provenance",
        "trace_capture": "D2_trace_granularity_v2"
      },
      "stage": "semantic_candidates"
    },
    {
      "chain_hash": "850daca9818c274ba9fcf0bb320cff31cfad463c3b20877e2bd3a1bb59a731d0",
      "changed_fields": [],
      "decisions": [],
      "dropped_fields": [],
      "granularity": {
        "candidate_to_resolved_field_map": {
          "candidate_trace": {},
          "resolved_fields": {
            "m1": {
              "certainty": "confirmed",
              "dose": "14 mg",
              "dose_unit": "mg",
              "dose_value": "14",
              "experiencer": "patient",
              "frequency": null,
              "laterality": null,
              "negated": false,
              "route": null,
              "status": "active",
              "temporality": "current"
            }
          }
        },
        "dropped_fields_by_stage": {},
        "ownership_decisions": {
          "attribute_ownership": {
            "experiencer": {
              "owner_mention_id": "context:e1",
              "owner_segment_id": "e1"
            }
          },
          "segment_provenance": {}
        },
        "per_mention_attributes": {
          "m1": {
            "fields": {
              "certainty": "confirmed",
              "dose": "14 mg",
              "dose_unit": "mg",
              "dose_value": "14",
              "experiencer": "patient",
              "frequency": null,
              "laterality": null,
              "negated": false,
              "route": null,
              "status": "active",
              "temporality": "current"
            },
            "surface": "adesivo"
          }
        },
        "per_mention_relations": {
          "m1": [
            {
              "relation_type": "CHANGED_FROM",
              "target": "dose",
              "value": "14 mg"
            }
          ]
        },
        "projection_field_map": {
          "m1": {
            "certainty": "confirmed",
            "dose": "14 mg",
            "dose_unit": "mg",
            "dose_value": "14",
            "experiencer": "patient",
            "frequency": null,
            "laterality": null,
            "negated": false,
            "route": null,
            "status": "active",
            "temporality": "current"
          }
        },
        "relation_generation_inputs": {
          "existing_projection_relations": [
            {
              "confidence": 1.0,
              "provenance": {